{
  "$schema": "../../chain.schema.json",
  "bob": "bob.svg",
  "bob-sepolia": "bob.svg",
  "ethereum": "ethereum.svg",
  "sepolia": "ethereum.svg",
  "bnb-smart-chain": "bsc.svg",
  "base": "base.svg",
  "op-mainnet": "optimism.svg",
  "arbitrum-one": "arbitrum.svg",
  "polygon": "polygon.svg",
  "avalanche": "avalanche.svg",
  "unichain": "unichain.svg",
  "sonic": "sonic.svg",
  "sei-network": "sei.svg",
  "soneium-mainnet": "soneium.svg",
  "berachain": "berachain.svg",
  "telos": "telos.svg",
  "plasma": "plasma.svg",
  "hyper-evm": "hyperevm.svg",
  "tron": "tron.svg",
  "solana": "solana.svg",
  "bitcoin": "bitcoin.svg",
  "signet": "signet.svg",
  "robinhood-chain": "robinhood.svg"
}
